<?xml version="1.0" encoding="UTF-8"?>
<!DOCTYPE language>
<language>
    <!-- To facilitate the validation and avoid duplicated key.
    please try to get language_no_dup_key.xsd from ...
        and change the beginig of the file with :
        
    <?xml version="1.0" encoding="UTF-8"?>
    <language xmlns:xsi="http://www.w3.org/2001/XMLSchema-instance" xsi:noNamespaceSchemaLocation="language_no_dup_key.xsd" >
        
-->
	<meta>
		<name>English</name>
		<author>Dan Royer (dan@marginallyclever.com)</author>
	</meta>

	<string>
		<key>BorderName</key>
		<value>Outline paper</value>
		<hint>Border generator</hint>
	</string>

	<string>
		<key>LissajousName</key>
		<value>Lissajous</value>
		<hint>Lissajous generator</hint>
	</string>
	<string>
		<key>KEY_A</key>
		<value>...</value>
                <hint></hint>
	</string>
	<string>
		<key>KEY_A</key>
		<value>...</value>
                <hint></hint>
	</string>
	<string>
		<key></key>
		<value>...</value>
		<hint></hint>
	</string>

	<string>
		<key>KEY_B</key>
		<value>...</value>
                <hint></hint>
	</string>
	<string>
		<key>KEY_B</key>
		<value>...</value>
                <hint></hint>
	</string>
</language>
